{
  "candidate_source_ids": [
    "source-04-foveated-rendering-a-state-of-the-art-survey--2a4e30f52f30",
    "source-05-interactive-level-of-detail-rendering-of-large-graphs--df4eb719b5f7",
    "source-02-image-based-crowd-rendering--565ae2b0e3a1",
    "source-03-skeleton-based-edge-bundling-for-graph-visualization--1a3dfa0e6b4c",
    "source-temporal-coherence-methods-in-real-time-rendering--5281f89f599e"
  ],
  "certainty": true,
  "decision": "new_source",
  "evidence": [
    "New source markdown identifies the work as \"A Perceptual Model of Motion Quality for Rendering with Adaptive Refresh-Rate and Resolution\" and gives DOI https://doi.org/10.1145/3386569.3392411.",
    "Candidate source-04-foveated-rendering-a-state-of-the-art-survey--2a4e30f52f30 is \"Foveated rendering: A state-of-the-art survey\" by Lili Wang, Xuehuai Shi, and Yi Liu, a 2023 Computational Visual Media review article about foveated rendering research from 1990 to 2021.",
    "Candidate source-05-interactive-level-of-detail-rendering-of-large-graphs--df4eb719b5f7 is \"Interactive Level-of-Detail Rendering of Large Graphs\" by Michael Zinsmaier, Ulrik Brandes, Oliver Deussen, and Hendrik Strobelt, with DOI 10.1109/TVCG.2012.238.",
    "Candidate source-02-image-based-crowd-rendering--565ae2b0e3a1 is \"Image-Based Crowd Rendering\" by Franco Tecchia, Celine Loscos, and Yiorgos Chrysanthou, focused on real-time animated crowd display in virtual cities.",
    "Candidate source-03-skeleton-based-edge-bundling-for-graph-visualization--1a3dfa0e6b4c is \"Skeleton-based edge bundling for graph visualization\" by Ozan Ersoy, Christophe Hurter, Fernando V Paulovich, Gabriel Cantareira, and Alexandru C Telea, with DOI 10.1109/TVCG.2011.233.",
    "Candidate source-temporal-coherence-methods-in-real-time-rendering--5281f89f599e is \"Temporal Coherence Methods in Real-Time Rendering\" and its DOI is 10.1111/j.1467-8659.2012.03075.x, which does not match the new source DOI."
  ],
  "matched_source_id": null,
  "rationale": "The newly ingested document is an ACM Transactions on Graphics 2020 article titled \"A Perceptual Model of Motion Quality for Rendering with Adaptive Refresh-Rate and Resolution\" with DOI 10.1145/3386569.3392411 and authors Gyorgy Denes, Akshay Jindal, Aliaksei Mikhailiuk, and Rafal K. Mantiuk. The bounded candidates have different titles, authors, venues/topics, and where a DOI is present it differs. The inspected markdown shows no candidate with matching canonical identifier, matching title/authorship, near-identical body text, or revision/version markers tying it to the new source."
}
